filename,label,filepath,transcript
audio_710.wav,1.0,/kaggle/input/dataset/Dataset/audios/train/audio_710.wav, you
audio_1265.wav,1.0,/kaggle/input/dataset/Dataset/audios/train/audio_1265.wav, My favorite hobby is cultivation of plants such as gardening. I can gain immense of plants to plant and the flowers and herbs to vegetables.
audio_1114.wav,1.5,/kaggle/input/dataset/Dataset/audios/train/audio_1114.wav," My goal is to become an electrical employee. Also I am studying the Electrical Electronics Engineering. To become an electrical engineer, I have to study about electrical. To achieve my goal is to have a good electronics. We have prepared the topics thoroughly to reach the goals."
audio_946.wav,1.5,/kaggle/input/dataset/Dataset/audios/train/audio_946.wav, The playground looks like very clear and neat as there are lot of colorful things like a basketball court for playing or we can do gym swing on swings group of friends together play very well and they love each other
audio_1127.wav,2.0,/kaggle/input/dataset/Dataset/audios/train/audio_1127.wav, My goal is to bring my parents to live with me and this is the only goal I have in my life and it's long term goal or short term goal whatever you want to say. My parents send me to study far from home because of my future. So that's my responsibility for their happiness I will bring to them with me because every parents love their child no matter how they want to live also with you and the challenges I face during this is competition. There is very high competition in the market but I still but this thing motivates me to focus and determine on the path to achieving my goal.
audio_669.wav,2.0,/kaggle/input/dataset/Dataset/audios/train/audio_669.wav," Today I am going to speak about the topic named crowded market. The market is always crowded with carts, horses, donkeys and camels and also cows. They came loaded with the produce of the season such as vegetables and cotton and fishes, oilseed, vegetables etc. Whenever I visited the crowded market, I find the shouting loudly to sell their goods. They sell their goods by shouting it loudly. They try to attract the people by several names and they also speak about the type of the item they are selling and the price of that item also and how much amount it cost for kg or for litre also."
audio_1029.wav,2.0,/kaggle/input/dataset/Dataset/audios/train/audio_1029.wav," I would like to go to the Sachi for the Sachi Stoop. It is a very famous place in the MP and there are local food will be good, very best food like Pav Haji and the latest it is like a sandwich and Maima sandwich is the famous food of the Sachi. And this is made by Samrat Ashok. They are the powerful emperor of the India. Its empire becomes over all the India and out of the India. He will be establish our empire to defeat the many kings and after that he made a stoop called a Sachi Stoop for Buddha. It is established in the Sachi."
audio_713.wav,2.0,/kaggle/input/dataset/Dataset/audios/train/audio_713.wav, There is someone who stole some product at the market and they hear the loud voice of the vendor shouting at the man. The consumers became scared and they ran.
audio_845.wav,2.5,/kaggle/input/dataset/Dataset/audios/train/audio_845.wav," The best day of my life is my 10th results. It was May 14, 2019. I think I think it was May 14, 2019. I got 10 by 10 CGPA, but I didn't like because I don't want to compare with others. My friends got 10 CGPA only, but my parents are compared with all members. If they have got very very better than me, then they will scold me. Otherwise, they will be very happy. And only if I got 8.9 CGPA, but we compare with the toppers, they got 9. When why did you give it to you? You didn't get 9 CGPA. They will scold me. If I didn't get 10 CGPA, then I would be very happy. And then I don't want to compare with others. Talent describes you more. When you."
audio_150.wav,2.0,/kaggle/input/dataset/Dataset/audios/train/audio_150.wav," 1. and that time you should be at the same time and that time I was at the same time I was at the same time and that time I was at the same time I was not away or not away One okong One okong Hua Wang Hua Wang One okong One okong Hua Wang Hua Wang Hua Wufu ب perché Так Master puffed a sweet laugh, screaming. Quickly turn the fire. Just a whistle trill. That was it. Then open up your 구독 ś jumping thoseious"
audio_764.wav,2.0,/kaggle/input/dataset/Dataset/audios/train/audio_764.wav," I am going to tell about my hobby and my hobby generally a hobby is considered as a regular activity that is done for enjoyment during leisure time. Hobby include themed items and objects engaging in creative and artistic pursuits, playing sports or doing any creative things or participating in any of the activities. I generally interested in reading books or developing fashions making it diverse and different from others. Hobbies tend to follow trends in society and also the advancing production and technology of this generation."
audio_1253.wav,2.5,/kaggle/input/dataset/Dataset/audios/train/audio_1253.wav," My favorite place is Shirdi and it is temple. We went to Shirdi with my family and we have enjoyed very lot. We have enjoyed very lot and Shirdi is look like a very beautiful. In Shirdi, the god is Sai Baba. We really enjoyed very much. In Shirdi, we visited near places like Shirdi Singalapuram and Nasik. In Nasik, Shiva is located as a god. There is a famous food called Pav Bhaji. It is mostly famous food and I like that food very much. It is a beautiful place."
audio_1271.wav,2.0,/kaggle/input/dataset/Dataset/audios/train/audio_1271.wav," My goal is I become an interpreter, because I am not work under anyone. I think to provide work to everyone, because my education is not to work from under anyone. I try to provide work to everyone and develop myself. Providing work is very good in the world, because giving work is good help to everyone. This is my long term goal to become an entrepreneur. Thank you."
audio_638.wav,2.5,/kaggle/input/dataset/Dataset/audios/train/audio_638.wav," My goal is editing. I have interested in editing field. Currently I am running a insta page. It is 5k followers. I am struggling to face how to add effects, how to cut videos, how to make video clips. Watching YouTube and learn these are effects. Starting stage is so difficult for learning. After that I feel free to edit. My insta page has also reached recently."
audio_755.wav,2.0,/kaggle/input/dataset/Dataset/audios/train/audio_755.wav," My hobby is to enjoy every moment of life, whatever it may be, it may be sad, happy or something else. Every moment is precious for us, so we need to enjoy every moment in our life, whatever it may be the result. We should not think on result, we should think on process, how the process is going on, then it will automatically give us a smile on our face and that is my ultimate goal. Not thinking of too much of result, what will happen now, tomorrow, day after tomorrow, My favorite hobby is to enjoy every moment of life and having smile on my face."
audio_950.wav,2.0,/kaggle/input/dataset/Dataset/audios/train/audio_950.wav," This is my school playground, looks like a small and you cannot anything in that playground and there is no any activities or activities that are popular among students on the playground. Only in the school playground you can listen only building only you can hear in schools mostly. And also listen to other classes how to tell teachers, free teachers and so much"
audio_1232.wav,2.5,/kaggle/input/dataset/Dataset/audios/train/audio_1232.wav, For me school ground was like a heaven where it brought all our sorrows and tears into a happiness where all our friends and family members of our cousins we laughed because it was a beautiful place we hear the laughs of every children. Nowadays I miss the school playground because I am in the college where I am busy with my academics. And for me my favorite game was shuttle where I played with my brother in school and I am the champion in the shuttle. I like the school playground and I miss the school playground nowadays too much. It was too good and those memories are too beautiful whenever I remember them. It was a good experience but I miss them.
audio_346.wav,2.5,/kaggle/input/dataset/Dataset/audios/train/audio_346.wav," My best day in my life also when I was successful in my life and my parents and my neighbourhoods and my friends said that I am successful in my career. That was my best day in my life. I am very happy when I achieved my goals. I am too proud of my family and my friends. My best day of life is when I am successful in my life. But due to I am in college, the day was not come yet. But I am trying to get successful in my life too. So I am working hard."
audio_730.wav,2.0,/kaggle/input/dataset/Dataset/audios/train/audio_730.wav," Generally, crowd markets contains in a different situation. It is mainly suitable for vegetables and where the people sell the vegetables at one place and people especially in middle class families come especially to purchase those vegetables in Sunday. And they would like to purchase those vegetables in different ways like buyers and sellers are accommodating in those places and they are bargaining for that vegetables. And so many people are there in that place where it was a crowd market and it was so busy and same vegetables are selling different different persons at different different prices and people are bargaining on that. And it was mainly on Sunday in India especially and the crowd market."
audio_783.wav,2.0,/kaggle/input/dataset/Dataset/audios/train/audio_783.wav, Describe your my favorite hobby. My favorite hobby is playing badminton and I play it with my son or with my husband or even my solo or alone time I want to Give this opportunity to play and practice of my hobby and then I want to play this to To get sweat and exercise as well every day it's a useful to our healthy and well-being when we get Not we getting younger we getting older by the time a year goes by So that's why this is my favorite hobby playing badminton as well I'm Using a raquette and a feather To play that badminton we enjoy it a lot with my son and with my family to play this every day
audio_39.wav,2.5,/kaggle/input/dataset/Dataset/audios/train/audio_39.wav, every person have a goal to achieve it for that he work hard and to be patient to achieve it my goal is to crack civil services and join in civil services main problem i face to achieve is it's a very tough exam and to crack this exam we need many sources and very patience
audio_292.wav,2.5,/kaggle/input/dataset/Dataset/audios/train/audio_292.wav," On the best day of my life is the day the university I attended hosted a game, a sport festival called Nougat which comprises all the old country, all the old university, state university, federal university in my country whereby the country, in particular my school hosted a competition. I was so happy, what made this special because me seeing different people from different culture, from different backgrounds in one place participating in sport, I feel elated. I was so happy. Whenever I think about this date, that particular day I'm so happy because I'm the kind of person that loves sport. Literally I participated in field hockey for my school in this particular day because I played field hockey for my school professionally but I love football. It was a very great day."
audio_880.wav,2.0,/kaggle/input/dataset/Dataset/audios/train/audio_880.wav," ok my best day life is watching good marks in 10th class exam, it is my best day and special day to me and also treat my special day to my parents also. In this I think when I writing exams it was difficult to me write exam sheet I cannot feel that it was a bad experience to me while writing exam I can think that I want get a good marks but after getting the result I felt very good by getting a good marks which was very very hopeful to me and also very pleasant to me while getting a good marks and my parents also very happy very enjoy which was getting my good marks and my friends also which was very pleasant and getting a good marks from me it was a good feel on that day I feel very better day to me to that day."
audio_921.wav,2.0,/kaggle/input/dataset/Dataset/audios/train/audio_921.wav, you
audio_68.wav,2.0,/kaggle/input/dataset/Dataset/audios/train/audio_68.wav," Yeah, I have a soy crowded market. There are different types of people out there. It's very crowded with a large number of people. On one side, some people are selling vegetables, some people are selling fruits, and some are selling other essential products that are required for the humans. And when I hear about the market, it's a fascinating thing that there will be a large number of the people. And from morning to evening, people work hard there to feed up themselves for their feed and all. And it's very... That's it."
audio_905.wav,2.0,/kaggle/input/dataset/Dataset/audios/train/audio_905.wav," my special day and which is the best day of my life that is my birthday when I was in 10th standard. It is my best day because every school friend was at my home and we had many memories. Without that day I think my life is incomplete. Whenever I remember that day I always get many thoughts about my school days and it remembers how we enjoyed in our schooling and also it brings a bright smile on my face. This is why this is I call that day as special as as I can say. The special day reminds me of all my schooling memories and how we fought, how we recollect and how we enjoyed our schooling with our friends. This is the best day of my life."
audio_1035.wav,2.5,/kaggle/input/dataset/Dataset/audios/train/audio_1035.wav," I would like to visit South Korea because I really love the place to visit once in a life. And I would like to travel to Europe because that would be my first experience. I would like to taste the local dishes in South Korea like kimchi, jampong, sushi and any other spicy dishes. I would like to visit the country in autumn season because the flowers or the cherry blossoms"
audio_1290.wav,2.5,/kaggle/input/dataset/Dataset/audios/train/audio_1290.wav," My goal is to become a bank employer and the goal is important to deserve the life. We must maintain one of the goals. I face many challenges while coming to the goal in my life. To become a bank employer, we have to face many problems. We have to face the challenges. I am ready to face the challenges whatever comes. I really struggle hard to work. I really struggle hard for successfully completing my life, my goal to become a bank employer. To become a bank employer, my mother motivated me."
audio_1221.wav,2.5,/kaggle/input/dataset/Dataset/audios/train/audio_1221.wav, So market is the place where the seller sells a goods to the buyer and buyer spends some money on the thing what the seller is selling. In Korean market every person want to sell their object or a thing. The seller talk or speak loudly about the product which was they selling and also they provide the price in the market when the people hear the price of the product they can go
audio_824.wav,2.0,/kaggle/input/dataset/Dataset/audios/train/audio_824.wav, At first my hobby was not special about particular topic but when I was in school I was mostly attracted to the tennis court game which was my hobby and I would like to play tennis court and in school times I have plenty of time to play that. Now I am in college right now I don't have time to play and I would like to play the tennis court game with others and tennis court game will be played as singles and doubles. I prefer to play as singles because as of one opposition of the player only one person so I can easily enjoy that game very well and tennis court game gives most enthusiastic energetic performance for me and for this game we use a tools like tennis court ring that is used to play that tennis court game.
audio_743.wav,2.0,/kaggle/input/dataset/Dataset/audios/train/audio_743.wav, Market is a crowded place and here selling and buying takes place and there are a lot of the people where transactions will be held there like exchanging between the seller and buyer goods and their vegetable vendors and some other things are going on in the market and here the day is crowded like whatever we want we go to the market and buy the ad and it is like shouting there like selling their prices and increasing as compared to the others and like that there will be takes place and market is a good thing to everyone to take the things from there and it is a crowded place the scene is too much cloudy and
audio_676.wav,2.5,/kaggle/input/dataset/Dataset/audios/train/audio_676.wav," Basically, market means market is full of crowd because everyone are selling and buying the vegetables. So everyone wants to sell and buy the vegetables because vegetables are the main source to eat. And it is the main important thing for our market and our direction. So everyone wants to go to market so that's why the market is crowd. Crowd means it is all about by buying and selling the vegetables and everyone wants to eat. So that's why the market is all about crowd."
audio_1111.wav,2.5,/kaggle/input/dataset/Dataset/audios/train/audio_1111.wav," Yes, there are several popular games and activities among students on the playground. Some common ones include tag, hopscotch, jump rope, poor square, basketball, soccer and various imaginative games like pretend player role-playing games. Trends may vary based on location, culture and age group but there are often staples in many school acts."
audio_354.wav,2.5,/kaggle/input/dataset/Dataset/audios/train/audio_354.wav," Best day in life is earning money. For everyone, money is most important. So, earning our self is a thing when we start earning. So, actually to earn money we have to know some skills. Even if we need money or to earn money we must complete our graduation or studies or need some skills. If we earn money while we are in school, it will be the best day for any student. I earn some money using referral apps. It makes a day which will be happy to everyone. Like me also, it's the best day. When I think about the day, it will be better than others. Because when we earn money, we own ourselves and purchase something which we need. So, that day is the best day."
audio_134.wav,2.5,/kaggle/input/dataset/Dataset/audios/train/audio_134.wav," The people are selling fruits and vegetables in the market. They just use fresh water, fresh fruits, fresh vegetables. Sound here in the market was just 20 rupees per kg. And according to people they can buy the fruit according to the best price. The crowd would change throughout the day from morning to evening. There is no such crowd in the early morning. But around 10 to 11 the crowd were increased and even in the evening the crowd was much better."
audio_881.wav,2.0,/kaggle/input/dataset/Dataset/audios/train/audio_881.wav," Yeah, the best day of my life is when I'm having a pregnant, when I get pregnant, when the time of, and when way back when I was 19 years old that time. And then this is the best day of my life, mixed emotions. I have a baby that year, 2011, and then mixed emotions, happy, sad, and I don't know what to do for being a first time mom. And then I grow and care my son from way back 2011 up to this point when he is turning 13 on December 12, 2011. And then thinking that day, I want to take good care of that child. Whatever happens, I'm a solo parent and then yeah, that's it."
audio_877.wav,2.0,/kaggle/input/dataset/Dataset/audios/train/audio_877.wav, I don't know. I don't know. You're not going to say no? No. No. The first day of my life was when I graduated from high school. I was so excited because I felt there's going to be a lot of opportunities for me. I felt so happy being there. I worked on the book I wrote. I ate so much to eat and drink. I was so happy. I was so happy to be there to grace the old events.
audio_687.wav,2.0,/kaggle/input/dataset/Dataset/audios/train/audio_687.wav, okay in code market there is a lot of people they are selling a lot of things like a large stone like a bike or car they are selling a lot of things which is lot of lot of stone and they can they sell a lot of things which can be incredible things they can be there in market we can see so many people from evening to morning they can sell different types of things from for their livelihood so so many people are present in there I think so many people have come there to enjoy and their life there was a present place there we can see that so many people like like we can see that no one can come there
audio_1120.wav,2.0,/kaggle/input/dataset/Dataset/audios/train/audio_1120.wav," My goal and importance is to become an IT sector employee and MNC reputed companies is long term goal, short term goal is to get in a job in IT sectors and it makes me proud to meet my parents and any challenges you can face to achieve this goal. My parents are too motivated to stay focused on this path to achieve your goal, to get a job in IT sectors and MNC companies. Mostly my parents and friends are too motivated to get a job in IT sectors."
audio_349.wav,2.0,/kaggle/input/dataset/Dataset/audios/train/audio_349.wav, So the topic is to describe the best day of your life. So the best day of my life is when I go to the tour in to mountain. I will climb the mountain and see natural beauties and meaningful faces and many more. I will climb 27 km in 15 hours and in mountains there are also some Jain temples and do very interesting and there are some fountains and mountains also. Thank you.
audio_1249.wav,2.0,/kaggle/input/dataset/Dataset/audios/train/audio_1249.wav," My favorite hobby is drawing and I lot enjoy when my creative thoughts are come to realistic with my drawings. I use so many tools like pencils and in the pencils there are so many shades like the 2B etc. I like to draw alone. In the most of the time I draw my class from when I was 12 years old. I will draw most of the things like my lectures, exam, drawing, books, and for the day."
audio_1214.wav,2.0,/kaggle/input/dataset/Dataset/audios/train/audio_1214.wav," Today I went to the supermarket and I have seen a lot of people, it is very crowded in the supermarket and most of the people are purchasing electronics which has an offer for the festival sale. I heard most of the announcements on the electronics which have the offer on the day. When I entered the market in the morning, it was fully crowded and when it comes to the evening, it is empty. The people, most of them are purchasing activities and figures and gaming consoles."
audio_19.wav,2.0,/kaggle/input/dataset/Dataset/audios/train/audio_19.wav," Describing about my hobbies, I would like to listen to songs when I was in free time and again I started to do things about myself to take care of myself and finish all of my things. Describing a favorite hobby, what do you enjoy the most about your hobby, are there any tools that you need to use for your hobby, do you enjoy practicing your hobby or other with others. I mostly like to spend time with myself only to take care of myself."
audio_1234.wav,2.5,/kaggle/input/dataset/Dataset/audios/train/audio_1234.wav," My town is my entire world. I was raised there. I was lot of lonely ending memories of it. I used to play there with my friends and cousins during my earlier. In my community everyone My town has many trees. I can only think of one spot. I enjoyed very well in my town. My favorite place is my hometown. In my hometown I enjoyed well. I get lot of happiness from my hometown because of my friends, family and relatives. There is more enough."
audio_679.wav,2.0,/kaggle/input/dataset/Dataset/audios/train/audio_679.wav," Actually, what are the people selling and buying in the market? In the market we see the people selling vegetables and fruits and flowers and many more things like the really hotels as well and the market is so much crowded actually because actually the market is much crowded in the morning early in the morning because the people will start cooking right from the morning itself like defense, next lunch, next dinner so definitely they need to buy in the morning most of them buy in the morning and the people like retail vegetables they had to get the vegetables at the normal at an affordable price then they had to go early in the morning and buy the vegetables with the offered."
audio_1322.wav,2.0,/kaggle/input/dataset/Dataset/audios/train/audio_1322.wav, my favorite place to visit is our province which is Bicol and I love Chabali I love going to Bicol because there's a local foods or dishes that which I love to eat there I can eat seafood there that we can get from a sea and we used to travel or to go to our province which is Bicol when it's Holy Week so where our whole family is gathering our Holy Week or spend our Holy Week to our province and we we bond and we celebrate or spend the Holy Week together with our whole family
audio_1030.wav,2.0,/kaggle/input/dataset/Dataset/audios/train/audio_1030.wav," My favorite place to visit is Rajasthan. It's a vibrant culture. There are different types of landscapes there. You can explore the places of Jaipur, witnessing the beautiful forts, different types of forts. You also have a desert to visit there in Rajasthan. In India, we can find only the desert in Rajasthan."
audio_712.wav,2.0,/kaggle/input/dataset/Dataset/audios/train/audio_712.wav," Market, we know market is a very crowded place. Market not only sells food essential or kitchen essential but also the things what we wear like clothes, shoes and many other things. In market while buying the things we choose places by their prices. When it comes to market we can hear lot of noises in the market. Also in the morning time it will be little crowded but as the day comes of the afternoon the noises started to increase."
