filename,label,filepath,transcript
audio_189.wav,4.0,/kaggle/input/dataset/Dataset/audios/train/audio_189.wav," My favorite hope in the world is watching sports. I'm an active lover of sports, all different kind of sports, soccer, cricket, rugby, F1, you name it. I do not mind watching it on my own on the weekends, especially on Saturdays. I can watch sports from the morning up until at night at 12 a.m. because everything is playing. I'm not just loving it because I just watch it because when I was growing up, I was exposed to a lot of different sports. So I played most of the sports. I played volleyball, I played cricket and I played soccer. And once in a while I would play tennis. So it's something that I both love and even enjoy watching now that I've gotten older and life is busy. I just watch now. I can't do much playing. There's not much time, but I..."
audio_16.wav,4.5,/kaggle/input/dataset/Dataset/audios/train/audio_16.wav," My favorite hobby is reading books. I read whenever I have free time. I read many kinds of books such as history books, science books. Sometimes it is novel and popular magazines. Reading has a lot of advantages. First, reading is a cheap way to get information and entertainment. Moreover, you can keep a book forever and read it many more times. Thus, reading is a convenient way for me to acquire a wonderful source of knowledge. Furthermore, reading books will contribute to my vocabulary expansion. The more I read, the more words I expose it to. And they will inevitably make their way to my mind. That therefore also helps to improve my memory. When I read a book, I have to remember this plot's characters, name, events so that my memory will become much better. Additionally, reading book is the best way to set"
audio_716.wav,4.5,/kaggle/input/dataset/Dataset/audios/train/audio_716.wav," If the bustling market vendors eagerly display their goods, enticing possibly with colorful arrays of fruits, vegetables, spices and fabrics, the air is thick with the aroma of freshly baked bread mingling with the pungent scent of spices. People haggle over prices, their voice rising above the dim of the crowd. Sellers call out their voice, each trying to attract attention with respective pitches. The market pitches with the platter of cards, the rules of bags and the jingles of the exchanging hands."
audio_54.wav,4.0,/kaggle/input/dataset/Dataset/audios/train/audio_54.wav," Cc hug. Lookin if I can bastard her real quick. Shoulders and neck. The The the by show show 20 خهم بنوجة rotten heart freedom poisoned Hu scaled his negatnic effort and attacked Hu and his friends. by the score of three, then by way of the bailout of three cubic ride mor sociais. The suspects were only celebrities, one of them was Terence Brown and the other was Henry Pop전es but in protest of their looting You can't see. You can't breathe. This is the best you can do."
audio_678.wav,4.5,/kaggle/input/dataset/Dataset/audios/train/audio_678.wav," So, what is a crowded market? Crowded markets are already after customers. A lot of options. They're usually full of well-established business with years of experience and serving the same customer. This market are sometimes called saturated market because they feel full. If you're like mostly entrepreneurs and small business owners, you're fighting your way through a crowded market right now. So how should you launch your new products and services in a market like this?"
audio_778.wav,4.0,/kaggle/input/dataset/Dataset/audios/train/audio_778.wav," My favorite hobby is video games. I enjoy playing the games on console. My favorite video game is soccer, and specifically FIFA. I just love playing FIFA. It's a game of different soccer teams from different clubs. It's mostly suitable for two players who come against each other. The goal of the game is to score more goals. To score more goals means a game. It's a classic game between two individuals. You can pick clubs from the four players."
audio_795.wav,4.0,/kaggle/input/dataset/Dataset/audios/train/audio_795.wav," Okay, so my most, I mean what do you call this one? My favorite hobby is playing chess. So chess is one of the oldest board games in the world and also one of the most popular whether you want to learn chess, to play casual games with your friends or to enter competitions. And now in this circle, you can learn all the information you need to know about the Royal Game and there are some pieces also called like pawn, rook, horse, king and also queen. There are also bishops. So I'm enjoying this game because it is very, you need to think before you do something to make sure that you will win in every game and that is the reason why I enjoy this game."
audio_503.wav,4.5,/kaggle/input/dataset/Dataset/audios/train/audio_503.wav," My favorite place to visit is New York City. It's definitely not an easy place to get to. The trip is about 25 hours and customs are very hard to get through. You have to have a visa and they're very strict about who they let in. I love New York pizza. They're $1 New York pizza sizes. It's just so cheap and so good and it just reminds me of New York. Again, in the summer, autumn and winter."
audio_92.wav,4.0,/kaggle/input/dataset/Dataset/audios/train/audio_92.wav," In the midst of a crowding market, people spawn around stalls, in culling iron and array of goods. Some salty fresh produce, carefully selecting ripe fruits and crops vegetable while others hunted for aromatic spices to infuse their meal with flavor. Customers reached out for colorful textiles, finger-tracing, intricate patterns, silk and craves, and cotton garments. Street food vendors attracted hunger patrons with the promise of savory kebabs, steaming dumplings and sweet treats, their tantalizing aromas and disusing pest passersby. The electric mix of shoppers to resort to surveillance to penetrate their business."
audio_756.wav,4.0,/kaggle/input/dataset/Dataset/audios/train/audio_756.wav," If I do this... I enjoy the most from my hobby because I'm able to stimulate brain cells and also get stronger and faster and everything in all those categories too for working out as well. And for studying, you know, just processing the information to comprehend more stuff and learning how to do things basically. I need books. Oh, okay. All right, okay. Tools. Okay, so what... I need books. Okay, so what... Other... Okay, so what... Other objects for work basically and I'm in for my hobby. I guess I enjoy practicing at home. From time to time, I enjoy doing it like every single day. For like five days, it'll be steady sessions for an hour."
audio_1152.wav,4.5,/kaggle/input/dataset/Dataset/audios/train/audio_1152.wav," My goal in life is to try my best to make a difference in the world and make the people that I love as happy as I can, taking care of my family, taking care of my wife, setting a good role model for my brother and sister, trying to achieve my best and to make a real difference in their lives and to make all of them hopeful and happy. One of the challenges that I might face is interruptions or distractions from achieving this goal and distractions can be really anything. However, the motivation behind this goal keeps me focused on it as much as possible. Trying to imagine the goal in the end achieved is very motivational and enlightening."
audio_700.wav,4.0,/kaggle/input/dataset/Dataset/audios/train/audio_700.wav," In a crowded hot market, vendors call out all their products such as chicken meat and pork meat, filling the air with the symphony of their voices. The smell of spicy spices on the breeze while the fruit and vegetables create a kaleidoscope of colors. It was so noisy and since morning the environment has changed throughout."
audio_312.wav,4.0,/kaggle/input/dataset/Dataset/audios/train/audio_312.wav," The best day of my life was July 22nd, 2023. That day was my cousin's wedding and I was overseas in Europe and it truly changed my life. I met someone there who I instantly clicked with and we spent the whole night together dancing and I was walking it in. And yeah, it was really fun and such fond memories and I think back to it, it was truly the happiest I've ever been. And seeing my cousin happy was cute. My whole family, my extended family, they had never met before at the wedding too. And for that one night I was able to forget about all the worries and stress and just be in the moment and enjoy myself. And yeah, my life would, the past six months would be extremely different if I hadn't."
audio_213.wav,4.0,/kaggle/input/dataset/Dataset/audios/train/audio_213.wav," that were no longer permanent. The other's who looks so The other's who's so not crazy Ah, it's, it's I'm one of the best at magazine Who I'm a I'm a I'm a I'm a I'm a I'm a I'm a I'm a I'm a I'm I'm I'm I'm I'm What I'm I'm I'm Spice I'm I'm I'm I'm I'm I'm I'm I'm I'm I'm I'm I'm"
audio_4.wav,4.0,/kaggle/input/dataset/Dataset/audios/train/audio_4.wav," So the crowded market scene, so people are selling fruits and vegetables. The sounds you can hear are the sound of people talking or the sound of the cars passing by. And the market scene changes according to the time. So in the morning it's more crowded and in the evening it's a little bit less crowded."
audio_197.wav,4.5,/kaggle/input/dataset/Dataset/audios/train/audio_197.wav," My favorite hobby is playing basketball. Basketball is more than just a hobby for me. It's a passion that fuels my spirit and energizes my soul. When I step onto the court, the world fades away and all that matters is the rhythm of the game. Dribbling the ball feels like an extension of my own body, each bounce echoing my determination and focus. As I maneuver past defenders, anticipation builds with every move, every feint and every shot. The sound of sneakers tweaking on the polished hardboard, the thud of the ball hitting the blackboard, the swish of a perfectly executed shot, these are the symphonies of basketball that resonate with me on a profound level. Whether I'm playing with friends at the local court or competing in a league game, the thrill of the competition drives me to push my limits and strive for excellence. But basketball is more than just physical prowess. It's a game of strategy, teamwork and resilience for me. That is why I love playing basketball."
audio_265.wav,4.5,/kaggle/input/dataset/Dataset/audios/train/audio_265.wav," Get back to Why do Bat assume he green blood, the face the cause. Start going I'm not going to show you what I'm going to show you. I'm going to show you how to do it. I'm going to show you how to do it. I'm going to show you how to do it. I'm going to show you how to do it. I'm going to show you how to do it. I'm going to show you how to do it. I'm going to show you how to do it. I'm going to show you how to do it. I'm going to show you how to do it. I'm going to show you how to do it."
audio_1314.wav,4.5,/kaggle/input/dataset/Dataset/audios/train/audio_1314.wav, This is a playground. It's 1130 and it's Monday. There are a lot of people. Four children are playing with the ball. A tall boy is eating a sandwich and the two shorter children are talking to him. A girl with glasses is throwing a boy into the bin. Three other boys are playing with the ball too. And some of them are eating sandwiches. We can see a girl sitting on the bench and writing on her notebook. Two boys are listening to music. One of them is singing and the other is dancing. A girl behind them is drinking some juice. One boy is skateboarding and next to the school gate. Another boy is climbing a tree. There is a girl standing on a bike. We can also see a man walking with his dog and a man driving to the school.
audio_77.wav,4.5,/kaggle/input/dataset/Dataset/audios/train/audio_77.wav," It's 6am in the morning, it's quiet, the sun has barely come up, the sky is dim blue, and it smells of the ocean. You're on a pier. You're at the Tokyo fish market. Now slowly as the minutes crawl by, sounds start crawling up. A car pulls up, some birds call a cow in the sky, a couple more people come. You start to hear conversation throughout the streets. And slowly you will see vendors opening their metal doors on their little cubicles of a store. They start cutting up the fish, the whole market starts smelling, and then all of a sudden everything snaps into place. The whole market comes to life and everything becomes bust."
audio_459.wav,4.5,/kaggle/input/dataset/Dataset/audios/train/audio_459.wav," Add new people. Add new people. Today the doctors are very shortly waiting for you to take part in the after hmm when you have a big and300 and a lot of pork baby and how You Oh HowLA194 no I'm going to the washroom. The washroom. I'm going to the washroom. I'm going to the washroom. Oh, it's so hot. Oh, it's so hot. Oh, it's so hot."
audio_302.wav,4.0,/kaggle/input/dataset/Dataset/audios/train/audio_302.wav," The best day of my life was the day the result of my third semester college got declared and I got 10 SGPA as a result and turned out to be the university top four. The day was very special not only because I got some amazing marks which I worked very hard for but in the sense that my parents were really really happy. They were so happy and this smile on their faces made all my efforts worth it. Furthermore, it established a concrete idea in my mind that all the work I'm putting in all the sacrifices that my parents are making are being paid off especially since those marks are going to get me a scholarship and my parents will be able to save the money that they would otherwise have to spend on all the education but those marks and those top ranks will not only help me gain confidence but also help me."
audio_385.wav,4.5,/kaggle/input/dataset/Dataset/audios/train/audio_385.wav, I can't do that work. I can't shout and snore. I can't do that work. I can't shout. I can't shout. I can't do that work. I can't shout. I can't shout. I can't do that work. I can't shout. I can't do that work. I can't shout and snore. I can't do that work. I can't do that work. I can't shout and snore. I can't do that work. I can't shout. I can't shout. I can't do that work. I can't do that work. I can't do that work.
audio_258.wav,4.0,/kaggle/input/dataset/Dataset/audios/train/audio_258.wav," When I think about it, it was the best experience. It was the best in my life. It was in the I'm going home. I'm going to sleep in the bed. I'm going to sleep in the bed. I'm going to sleep. I'm going to sleep in the bed. I'm going to sleep. I'm going to sleep in the bed. I'm going to crash. Crash. I'm going to crash. I'm going to crash. I'm going to crash. I'm going to crash. I'm going to crash."
audio_69.wav,4.0,/kaggle/input/dataset/Dataset/audios/train/audio_69.wav," In the heart of the market, stalls adorned with colorful canopies form a maze of offerings, each one a treasure trove of goods. Vendors enthusiastically engage with customers and their voices competing for attention amidst the canopy of bargaining and laughter. The air is heavy with the aroma of spices, sizzling street food and the sweet scent of ripe fruits, creating an intoxicating sensory experience. Everywhere you look, there's a cataclysm of humanity, choppers bargaining for deals, children darting between legs and local and tourist alike immersing themselves in the vibrant tapestry of culture and comments."
audio_135.wav,4.5,/kaggle/input/dataset/Dataset/audios/train/audio_135.wav," Good afternoon. I am about to describe the scene of a crowded market. In the crowded market, people are selling and buying many things. They are selling things like vegetables, fruits, meat, fish and also the provisions that are needed by people. And also there are certain amount of people who are buying the provisions that are sold by the vendors. I can hear multiple sounds in the market such as the vendors demanding that their product is best and cheaper when compared to the other products. The crowded market scene changes throughout the day because in the morning it is very crowded. But as the day goes by, when it reaches afternoon, it is little crowded and when it reaches the evening, it is not crowded at all. So this is how a scene of a crowded market seems like. Thank you."
audio_84.wav,4.0,/kaggle/input/dataset/Dataset/audios/train/audio_84.wav," I walked up to the crowded market in downtown Bangkok, Thailand. The people are selling different foods, fabrics, and products. Some are handmade and some are packed in plastic. There are thousands of people there, selling and buying and trading. I can hear the sounds of people haggling over the price of the different products. The market is busiest in the morning. People get there around 7.30 in the morning and the market starts to close down around 11 in the morning. The market is a great place to buy fresh fruits and vegetables and there are stands of people who are selling prepared foods."
audio_1224.wav,4.0,/kaggle/input/dataset/Dataset/audios/train/audio_1224.wav," The school playground is a vibrant canvas of youthful energy and activity bustling with the sounds of laughter, chatter and playful experiences. As the morning sun baths the area in a warm glow, children of all ages flock to the open space eager to partake in the array of recreational opportunities it offers. On the basketball court, students engage in spirited games of hops, dribbling and shooting with determination and skills. The rhythmic third of the ball against the pavement punctures the air, accompanied by the occasional cheer or groan of disappointment as shots are made of mist. Underneath the shadow of a towering oak tree cluster, all of students gather to chat and relax."
audio_1128.wav,4.0,/kaggle/input/dataset/Dataset/audios/train/audio_1128.wav," My goal is to become an entrepreneur. It revolves around creating and growing a successful business venture. This can include objectives such as developing innovative products or services, building a strong brand, expanding market reach, increasing profitability and making a positive impact. This goal is important to all the citizens as it is a developing objectives. Entrepreneurs often strive for financial independence, creative fulfilment and the ability to make a difference in the world through their ventures. It is important because they make a difference in the world. They may also aim to inspire others, mentor aspiring entrepreneurs or contributors."
audio_428.wav,4.5,/kaggle/input/dataset/Dataset/audios/train/audio_428.wav, I'm going to go to bed. I'm going to go to bed. I'm going to go to bed. I'm going to go to bed. I'm going to go to bed. I'm going to go to bed. I'm going to go to bed.
audio_1012.wav,4.0,/kaggle/input/dataset/Dataset/audios/train/audio_1012.wav," The school playground is lively and filled with colorful equipment like swings and slides. Children engage in various games like dodgeball or soccer. It's normally filled with laughter and chatters in the air. It's normally accompanied with sounds of swings, squeaking and balls bouncing. It's a dynamic environment where friendships are formed and memories are made. Those are experiences from the school playground and scenes you could find on the school playground."
audio_495.wav,4.5,/kaggle/input/dataset/Dataset/audios/train/audio_495.wav," My favorite place to visit is my hometown. I have moved 13 times during my life, so I love going back to my hometown after years and seeing how it changes every time. I was born in this very small town with less than 200,000 people. It might seem like a lot of people, but it's actually not. We didn't even have a shopping mall at the time, so that's why I love going back and see how everything changes, how everything modernizes. I know there are some people that hate that, but I personally think it's progress, and I love seeing people getting access to things they didn't have before, such as more stores, more access to banks, more schools. I love going back and seeing how my lovely hometown is getting more modern each year."
audio_280.wav,4.5,/kaggle/input/dataset/Dataset/audios/train/audio_280.wav," The best day of one's life is a deeply personal topic, at least varies greatly from person to person. For some, it might be a day filled with joyous milestones like wedding, the birth of a child or achieving a long-held dream. For others, it could be a simply day spent in the company of loved ones enjoying meaningful conversations and shared laughter. The best day of my life involves moments of connection, fulfillment and gratitude with my loved ones and my family. It was a function in my family when all the people of my family gathered together and we had a bunch of a time with laughter, happy food and enjoying. The best day of life involves it. It could be a day when everything seemed to align perfectly, when worries melted away and when memories were made that could be cherished forever."
audio_789.wav,4.5,/kaggle/input/dataset/Dataset/audios/train/audio_789.wav," Drawing has my passion as long as I can remember. It's not just a hobby, it's a way of my life for me. Every time I pick up my pencil or pen, I feel like I'm entering in a world of endless possibilities. There is something totally magical about bringing ideas to life through art. Whether it is sketching portraits, creating a vibrant landscape or designing a creature, drawing allows me to unleash my imagination and express myself in a way that simply I can't capture. And drawing is more than just a painting on a paper. It's a form of meditation for me. According to me, it's a meditation. The rhythmic motion and the pencil against the page and the concentration, which I had required to capture the what scene I have created in mind, I can achieve it only through the painting. And it's not just a painting."
audio_388.wav,4.5,/kaggle/input/dataset/Dataset/audios/train/audio_388.wav," The playground has many different items available on it for the purpose of entertaining all of the children that come to it each day. There are numerous amounts of swings for children to get on and have fun with. There are slides. There is a sand pit area with various different items for children to engage with. They have a four square game available. They also have hopscotch, something that the children love. You can hear very many children running around screaming and shouting."
audio_1215.wav,4.0,/kaggle/input/dataset/Dataset/audios/train/audio_1215.wav," A marketplace is an exceptionally bustling spot where individuals go to purchase things of their needs like fish, vegetable, and other stuff. It is a focal point of fascination for the two purchasers and vendors like a seller and the buyer. There is no other place in the zone having so much lively business as the market. What you can hear in the market is all the seller who sells their items that started with the low amount. For example, the market was bustling with vendors and shoppers, all huddling for the best deals. The bustling market was so infectious that you couldn't help but get caught up in the excitement."
audio_182.wav,4.5,/kaggle/input/dataset/Dataset/audios/train/audio_182.wav," Recently, my hobby has been to create videos on YouTube. So becoming a content creator. The most enjoyable part of this hobby is to express my views in a very unique way, which is not there out in the world. The tools which I use for this hobby is mostly a camera, three light sources, and a good quality mic, a USB audio interface, and a computer to process my audio. I enjoy this hobby sometimes alone, but other times with my friend because it's really fun to compose a shot and create a unique way of content which I like."
audio_566.wav,4.5,/kaggle/input/dataset/Dataset/audios/train/audio_566.wav, you
audio_321.wav,4.5,/kaggle/input/dataset/Dataset/audios/train/audio_321.wav," The best day of my life was when I received the notification that I got a scholarship in my dream school. It changed the trajectory of my life as I was able to find better employment and elevate my quality of life. When I think about it, up to this day I still feel very grateful and excited about that news."
audio_586.wav,4.5,/kaggle/input/dataset/Dataset/audios/train/audio_586.wav, you
audio_1066.wav,4.5,/kaggle/input/dataset/Dataset/audios/train/audio_1066.wav," My favorite place to visit is the sushi restaurant. I enjoy going there. The weather is usually cold and it's quite windy. And the feeling of relief when I arrive at the sushi restaurant is just great that somehow I am now safe from the windy weather and chilly cold. I like looking at the menu and choosing the sushi that I enjoy. It is very refreshing. I like it a lot. Usually during that time it will be perfect if it's during spring. However, any other time is also fine. However, in the spring it's very nice because the trees look beautiful and it's sunny and the weather is calming to the nerves. So it's quite relaxing. Eating sushi until I am extremely full is just a very enjoyable experience for me. And I like doing it with a person."
audio_360.wav,4.5,/kaggle/input/dataset/Dataset/audios/train/audio_360.wav," A school playground has a lot of slides, monkey bars, areas that children can play in. It has benches that you can sit on if you're not a child. There's also a lot of grass. There's a lot of sand in the kids play area. There's a lot of cars that'll drive by. Overall, it's a nice scenery. There's a lot of trees. There's water fountains if you want to get something to drink."
